OBJECT_NAME,OBJECT_IDENTIFIER,OBJECT_DATA_TYPE,OBJECT_PREMISSIONS,OBJECT_CLASS,OBJECT_NODE_TYPE,OBJECT_DESCRIPTION
ifTestTable,1.3.6.1.2.1.31.1.3,,no-access,objecttype,table,"This table contains one entry per interface. It defines objects which allow a network manager to instruct an agent to test an interface for various faults. Tests for an interface are defined in the media-specific MIB for that interface. After invoking a test, the object ifTestResult can be read to determine the outcome. If an agent can not perform the test, ifTestResult is set to so indicate. The object ifTestCode can be used to provide further test- specific or interface-specific (or even enterprise-specific) information concerning the outcome of the test. Only one test can be in progress on each interface at any one time. If one test is in progress when another test is invoked, the second test is rejected. Some agents may reject a test when a prior test is active on another interface. Before starting a test, a manager-station must first obtain 'ownership' of the entry in the ifTestTable for the interface to be tested. This is accomplished with the ifTestId and ifTestStatus objects as follows: try_again: get (ifTestId, ifTestStatus) while (ifTestStatus != notInUse) /* * Loop while a test is running or some other * manager is configuring a test. */ short delay get (ifTestId, ifTestStatus) } /* * Is not being used right now -- let's compete * to see who gets it. */ lock_value = ifTestId if ( set(ifTestId = lock_value, ifTestStatus = inUse, ifTestOwner = 'my-IP-address') == FAILURE) /* * Another manager got the ifTestEntry -- go * try again */ goto try_again; /* * I have the lock */ set up any test parameters. /* * This starts the test */ set(ifTestType = test_to_run); wait for test completion by polling ifTestResult when test completes, agent sets ifTestResult agent also sets ifTestStatus = 'notInUse' retrieve any additional test results, and ifTestId if (ifTestId == lock_value+1) results are valid A manager station first retrieves the value of the appropriate ifTestId and ifTestStatus objects, periodically repeating the retrieval if necessary, until the value of ifTestStatus is 'notInUse'. The manager station then tries to set the same ifTestId object to the value it just retrieved, the same ifTestStatus object to 'inUse', and the corresponding ifTestOwner object to a value indicating itself. If the set operation succeeds then the manager has obtained ownership of the ifTestEntry, and the value of the ifTestId object is incremented by the agent (per the semantics of TestAndIncr). Failure of the set operation indicates that some other manager has obtained ownership of the ifTestEntry. Once ownership is obtained, any test parameters can be setup, and then the test is initiated by setting ifTestType. On completion of the test, the agent sets ifTestStatus to 'notInUse'. Once this occurs, the manager can retrieve the results. In the (rare) event that the invocation of tests by two network managers were to overlap, then there would be a possibility that the first test's results might be overwritten by the second test's results prior to the first results being read. This unlikely circumstance can be detected by a network manager retrieving ifTestId at the same time as retrieving the test results, and ensuring that the results are for the desired request. If ifTestType is not set within an abnormally long period of time after ownership is obtained, the agent should time-out the manager, and reset the value of the ifTestStatus object back to 'notInUse'. It is suggested that this time-out period be 5 minutes. In general, a management station must not retransmit a request to invoke a test for which it does not receive a response; instead, it properly inspects an agent's MIB to determine if the invocation was successful. Only if the invocation was unsuccessful, is the invocation request retransmitted. Some tests may require the interface to be taken off-line in order to execute them, or may even require the agent to reboot after completion of the test. In these circumstances, communication with the management station invoking the test may be lost until after completion of the test. An agent is not required to support such tests. However, if such tests are supported, then the agent should make every effort to transmit a response to the request which invoked the test prior to losing communication. When the agent is restored to normal service, the results of the test are properly made available in the appropriate objects. Note that this requires that the ifIndex value assigned to an interface must be unchanged even if the test causes a reboot. An agent must reject any test for which it cannot, perhaps due to resource constraints, make available at least the minimum amount of information after that test completes."
ifTestEntry,1.3.6.1.2.1.31.1.3.1,,no-access,objecttype,row,"An entry containing objects for invoking tests on an interface."
ifTestId,1.3.6.1.2.1.31.1.3.1.1,testandincr,read-write,objecttype,column,"This object identifies the current invocation of the interface's test."
ifTestStatus,1.3.6.1.2.1.31.1.3.1.2,integer,read-write,objecttype,column,"This object indicates whether or not some manager currently has the necessary 'ownership' required to invoke a test on this interface. A write to this object is only successful when it changes its value from 'notInUse(1)' to 'inUse(2)'. After completion of a test, the agent resets the value back to 'notInUse(1)'. Enumeration: 'inUse': 2, 'notInUse': 1."
ifTestType,1.3.6.1.2.1.31.1.3.1.3,autonomoustype,read-write,objecttype,column,"A control variable used to start and stop operator- initiated interface tests. Most OBJECT IDENTIFIER values assigned to tests are defined elsewhere, in association with specific types of interface. However, this document assigns a value for a full-duplex loopback test, and defines the special meanings of the subject identifier: noTest OBJECT IDENTIFIER ::= { 0 0 } When the value noTest is written to this object, no action is taken unless a test is in progress, in which case the test is aborted. Writing any other value to this object is only valid when no test is currently in progress, in which case the indicated test is initiated. When read, this object always returns the most recent value that ifTestType was set to. If it has not been set since the last initialization of the network management subsystem on the agent, a value of noTest is returned."
ifTestResult,1.3.6.1.2.1.31.1.3.1.4,integer,read-only,objecttype,column,"This object contains the result of the most recently requested test, or the value none(1) if no tests have been requested since the last reset. Note that this facility provides no provision for saving the results of one test when starting another, as could be required if used by multiple managers concurrently. Enumeration: 'none': 1, 'success': 2, 'failed': 7, 'unAbleToRun': 5, 'aborted': 6, 'inProgress': 3, 'notSupported': 4."
ifTestCode,1.3.6.1.2.1.31.1.3.1.5,object identifier,read-only,objecttype,column,"This object contains a code which contains more specific information on the test result, for example an error-code after a failed test. Error codes and other values this object may take are specific to the type of interface and/or test. The value may have the semantics of either the AutonomousType or InstancePointer textual conventions as defined in RFC 2579. The identifier: testCodeUnknown OBJECT IDENTIFIER ::= { 0 0 } is defined for use if no additional result code is available."
ifTestOwner,1.3.6.1.2.1.31.1.3.1.6,ownerstring,read-write,objecttype,column,"The entity which currently has the 'ownership' required to invoke a test on this interface."
ifRcvAddressTable,1.3.6.1.2.1.31.1.4,,no-access,objecttype,table,"This table contains an entry for each address (broadcast, multicast, or uni-cast) for which the system will receive packets/frames on a particular interface, except as follows: - for an interface operating in promiscuous mode, entries are only required for those addresses for which the system would receive frames were it not operating in promiscuous mode. - for 802.5 functional addresses, only one entry is required, for the address which has the functional address bit ANDed with the bit mask of all functional addresses for which the interface will accept frames. A system is normally able to use any unicast address which corresponds to an entry in this table as a source address."
ifRcvAddressEntry,1.3.6.1.2.1.31.1.4.1,,no-access,objecttype,row,"A list of objects identifying an address for which the system will accept packets/frames on the particular interface identified by the index value ifIndex."
ifRcvAddressAddress,1.3.6.1.2.1.31.1.4.1.1,physaddress,no-access,objecttype,column,"An address for which the system will accept packets/frames on this entry's interface."
ifRcvAddressStatus,1.3.6.1.2.1.31.1.4.1.2,rowstatus,read-only,objecttype,column,"This object is used to create and delete rows in the ifRcvAddressTable."
ifRcvAddressType,1.3.6.1.2.1.31.1.4.1.3,integer,read-only,objecttype,column,"This object has the value nonVolatile(3) for those entries in the table which are valid and will not be deleted by the next restart of the managed system. Entries having the value volatile(2) are valid and exist, but have not been saved, so that will not exist after the next restart of the managed system. Entries having the value other(1) are valid and exist but are not classified as to whether they will continue to exist after the next restart. Enumeration: 'nonVolatile': 3, 'other': 1, 'volatile': 2."
ifTableLastChange,1.3.6.1.2.1.31.1.5,timeticks,read-only,objecttype,scalar,"The value of sysUpTime at the time of the last creation or deletion of an entry in the ifTable. If the number of entries has been unchanged since the last re-initialization of the local network management subsystem, then this object contains a zero value."
ifStackLastChange,1.3.6.1.2.1.31.1.6,timeticks,read-only,objecttype,scalar,"The value of sysUpTime at the time of the last change of the (whole) interface stack. A change of the interface stack is defined to be any creation, deletion, or change in value of any instance of ifStackStatus. If the interface stack has been unchanged since the last re-initialization of the local network management subsystem, then this object contains a zero value."
ifConformance,1.3.6.1.2.1.31.2,,,objectidentity,,""
ifGroups,1.3.6.1.2.1.31.2.1,,,objectidentity,,""
ifGeneralGroup,1.3.6.1.2.1.31.2.1.1,,,objectgroup,,"A collection of objects deprecated in favour of ifGeneralInformationGroup."
ifFixedLengthGroup,1.3.6.1.2.1.31.2.1.2,,,objectgroup,,"A collection of objects providing information specific to non-high speed (non-high speed interfaces transmit and receive at speeds less than or equal to 20,000,000 bits/second) character-oriented or fixed-length-transmission network interfaces."
ifHCFixedLengthGroup,1.3.6.1.2.1.31.2.1.3,,,objectgroup,,"A collection of objects providing information specific to high speed (greater than 20,000,000 bits/second) character- oriented or fixed-length-transmission network interfaces."
ifPacketGroup,1.3.6.1.2.1.31.2.1.4,,,objectgroup,,"A collection of objects providing information specific to non-high speed (non-high speed interfaces transmit and receive at speeds less than or equal to 20,000,000 bits/second) packet-oriented network interfaces."
ifHCPacketGroup,1.3.6.1.2.1.31.2.1.5,,,objectgroup,,"A collection of objects providing information specific to high speed (greater than 20,000,000 bits/second but less than or equal to 650,000,000 bits/second) packet-oriented network interfaces."
ifVHCPacketGroup,1.3.6.1.2.1.31.2.1.6,,,objectgroup,,"A collection of objects providing information specific to higher speed (greater than 650,000,000 bits/second) packet- oriented network interfaces."
ifRcvAddressGroup,1.3.6.1.2.1.31.2.1.7,,,objectgroup,,"A collection of objects providing information on the multiple addresses which an interface receives."
ifTestGroup,1.3.6.1.2.1.31.2.1.8,,,objectgroup,,"A collection of objects providing the ability to invoke tests on an interface."
ifStackGroup,1.3.6.1.2.1.31.2.1.9,,,objectgroup,,"The previous collection of objects providing information on the layering of MIB-II interfaces."
ifGeneralInformationGroup,1.3.6.1.2.1.31.2.1.10,,,objectgroup,,"A collection of objects providing information applicable to all network interfaces."
ifStackGroup2,1.3.6.1.2.1.31.2.1.11,,,objectgroup,,"A collection of objects providing information on the layering of MIB-II interfaces."
ifOldObjectsGroup,1.3.6.1.2.1.31.2.1.12,,,objectgroup,,"The collection of objects deprecated from the original MIB- II interfaces group."
ifCounterDiscontinuityGroup,1.3.6.1.2.1.31.2.1.13,,,objectgroup,,"A collection of objects providing information specific to interface counter discontinuities."
linkUpDownNotificationsGroup,1.3.6.1.2.1.31.2.1.14,,,notificationgroup,,"The notifications which indicate specific changes in the value of ifOperStatus."
ifCompliances,1.3.6.1.2.1.31.2.2,,,objectidentity,,""
ifCompliance,1.3.6.1.2.1.31.2.2.1,,,modulecompliance,,"A compliance statement defined in a previous version of this MIB module, for SNMP entities which have network interfaces."
ifCompliance2,1.3.6.1.2.1.31.2.2.2,,,modulecompliance,,"A compliance statement defined in a previous version of this MIB module, for SNMP entities which have network interfaces."
ifCompliance3,1.3.6.1.2.1.31.2.2.3,,,modulecompliance,,"The compliance statement for SNMP entities which have network interfaces."
linkDown,1.3.6.1.6.3.1.1.5.3,,,notificationtype,,"A linkDown trap signifies that the SNMP entity, acting in an agent role, has detected that the ifOperStatus object for one of its communication links is about to enter the down state from some other state (but not from the notPresent state). This other state is indicated by the included value of ifOperStatus."
linkUp,1.3.6.1.6.3.1.1.5.4,,,notificationtype,,"A linkUp trap signifies that the SNMP entity, acting in an agent role, has detected that the ifOperStatus object for one of its communication links left the down state and transitioned into some other state (but not into the notPresent state). This other state is indicated by the included value of ifOperStatus."